IS_ANDROID VERSION,IS_APP USABILITY,IS_BATTERY,IS_COMPLAINT,IS_DEVICE,IS_HARDWARE,IS_LICENSING,IS_MEMORY,IS_PERFORMANCE,IS_PRICE,IS_PRIVACY,IS_SECURITY,IS_UI,Unnamed: 0,_id,app,appVersion,author,date,ratingStars,reviewText
0,0,0,0,0,0,0,0,0,0,0,0,0,4613,57291460507c69054da8e577,Pixel Dungeon,1.9.2a,Noah Nelson,04.01.16,5,Cool game I teally like this addictive game
0,0,0,0,0,0,0,0,0,0,0,0,0,4614,57291460507c69054da8e578,Pixel Dungeon,1.9.2a,Andrew Roberts,04.01.16,5,Game needs: This is a great game that me and my friends play and talk about together all the time but it would be a lot better with a multiplayer mode. So you could play with your near by friends or connect with people over Facebook or Google to play more long distance games
0,0,0,0,0,0,0,0,0,0,0,0,0,4615,57291460507c69054da8e579,Pixel Dungeon,1.9.2a,Benji Sesega,04.01.16,5,This game will make you rage quit so bad you'll play it again afterwards. It's a good game guys.
0,0,0,0,0,0,0,0,0,0,0,0,0,4616,57291464507c69054da8e57a,Pixel Dungeon,1.9.2a,Maciej akomy,04.01.16,5,"Beated the game Reached the door behind amulet, they were locked, said stay tuned for more features, unfortunately didn't get there another time to check"
0,1,0,0,0,0,0,0,0,0,0,0,0,4617,57291464507c69054da8e57c,Pixel Dungeon,1.9.2a,-Lordjm-,03.01.16,5,"Simple and fun This game is very well designed, with the simple pixel art, to the rpg battles, this game has to be played by anybody who like pixel and rpg."
0,0,0,0,0,0,0,0,0,0,0,0,0,4618,57291467507c69054da8e57d,Pixel Dungeon,1.9.2a,Josh Thompson,03.01.16,5,Incredibly addicting and enraging
0,0,0,0,0,0,0,0,0,0,0,0,0,4619,57291467507c69054da8e57e,Pixel Dungeon,1.9.2a,Díü„Äêí¬lê_aí¢_üêêÙ BíüêÏñÔíüaíá„ í¥ê_êÛ_Àêí¤,03.01.16,5,Great gameplay Bought the steam version also like yipe for android
0,0,0,0,0,0,0,0,0,0,0,0,0,4621,57291469507c69054da8e581,Pixel Dungeon,1.9.2a,Douglas Palomino,02.01.16,5,5 10 if I could.
0,0,0,0,0,0,0,0,0,0,0,0,0,4622,57291469507c69054da8e583,Pixel Dungeon,1.9.2a,Jonathan Kornell,02.01.16,5,Love it Awesome
0,0,0,0,0,0,0,0,0,0,0,0,0,4623,5729146c507c69054da8e585,Pixel Dungeon,1.9.2a,Joaquin Garcia,01.01.16,5,"Fun Roguelike game Roguelikes aren't for everyone, but if you're looking for one to play on your phone, this is a great one. It's not as kitchen-sinky as Nethack, but it'll do."
0,0,0,0,0,0,0,0,0,0,0,0,0,4624,5729146c507c69054da8e586,Pixel Dungeon,1.9.2a,philip king,01.01.16,4,Can u save at all Im wondering if u can save
0,0,0,0,0,0,0,0,0,0,0,0,0,4625,5729146c507c69054da8e587,Pixel Dungeon,1.9.2a,Coolpuppy24,01.01.16,5,"Hard but funn Its very hard for me and really pushes me to be very focused, or I just stink at the game. (best is lv 4) but really fun overall."
0,0,0,0,0,0,0,0,0,0,0,0,0,4626,57291475507c69054da8e588,Pixel Dungeon,1.9.2a,Anthony Vanover,01.01.16,5,A great title that honors the classic rogue. Very enjoyable and each play through is different as you would expect from a rogue like game. The quaint pixel art and strange music makes it all the more immersive. Can be put down and picked up at any time.
0,0,0,0,0,0,0,0,0,0,0,0,0,4627,57291478507c69054da8e589,Pixel Dungeon,1.9.2a,Dipanshu Krishan,01.01.16,4,"It's growing on me. Really rewarding, even tho I suck at it."
0,0,0,0,0,0,0,0,0,0,0,0,1,4628,57291478507c69054da8e58a,Pixel Dungeon,1.9.2a,Lahya2000,01.01.16,5,"Awesome Game Super fun dungeon diver!! Very creative and addictive, love the design and everything about it"
1,1,0,1,0,1,0,0,0,1,0,0,0,4629,5729147b507c69054da8e58c,Pixel Dungeon,1.9.2a,John Enfield,01.01.16,5,"Deceptively Simple Seems like a simple bit of shovelware, but don't let the crude graphics fool you. This is one tough roguelike game. Under the primitive veneer is a sophisticated Dungeon crawler. Seems to have randomized levels as each time I die (and you will die in this game) and start over, the levels are different. Possibly the best free game on Google play. It runs solid on my Android 4.4.1 running tablet too. No problems with it so far."
0,0,0,0,0,0,0,0,0,0,0,0,0,4630,5729147b507c69054da8e58e,Pixel Dungeon,1.9.2a,Ethan Gallart,01.01.16,4,I want to make levels Would be awesome if you guys could make it so that I can make my own levels but other wise I like it
0,0,0,0,0,0,0,0,0,0,0,0,0,4631,5729147e507c69054da8e590,Pixel Dungeon,1.9.2a,Tre Figueroa,31.12.15,1,So boring Its so hard to control
0,0,0,0,0,0,0,0,0,0,0,0,0,4632,5729147e507c69054da8e591,Pixel Dungeon,1.9.2a,Lucas Gould,30.12.15,4,Fun I like it but its hard asf at first haha
0,0,0,0,0,0,0,0,0,0,0,0,0,4633,5729147e507c69054da8e592,Pixel Dungeon,1.9.2a,Matthew Abbott,30.12.15,5,"Roguelike It is a roguelike, and if you like that you will almost surely like this."
0,0,0,1,0,0,0,0,0,0,0,0,0,4634,5729147e507c69054da8e593,Pixel Dungeon,1.9.2a,Madhav Bansal,30.12.15,3,It's time waste It's very boring and useless
0,0,0,1,0,0,0,0,0,0,0,0,0,4635,57291482507c69054da8e594,Pixel Dungeon,1.9.2a,Moha Zeffis,30.12.15,5,Found a bug I recently fought with the goo.When I fought him/it I got the chaotic ooze.I ignored it went to next level.I found that chaotic oooze was never wearing off.I drank health potion and ate food and it still never came off so I bought an ankh as a last resort
0,0,0,0,0,0,0,0,0,0,0,0,0,4636,57291482507c69054da8e595,Pixel Dungeon,1.9.2a,ironcladgem 275,29.12.15,5,Fun Its really cute and addictive
0,0,0,0,0,0,0,0,0,0,0,0,0,4637,57291482507c69054da8e596,Pixel Dungeon,1.9.2a,Amy Miller,29.12.15,5,"Great way to waste time OFFline! Great game, with options of three original characters, one optional awarded to those with tenacity. Great game for all ages!"
0,0,0,0,0,0,0,0,0,0,0,0,0,4638,57291485507c69054da8e597,Pixel Dungeon,1.9.2a,Lazar Mikic,29.12.15,5,Best game ever! Out of all the games I played this is the best so far.
0,0,0,0,0,0,0,0,0,0,0,0,0,4639,57291485507c69054da8e598,Pixel Dungeon,1.9.2a,Shinjer Wong,29.12.15,5,Huntress Huntress should make a ability to knew the potion of mind vision because every job got their own ability to knew a scroll or a potion.
0,0,0,0,0,0,0,0,0,0,0,0,0,4640,57291485507c69054da8e599,Pixel Dungeon,1.9.2a,David Potter,29.12.15,2,"Okay. I don't like the addition of durability on items, totally ruins what was a great game."
0,0,0,0,0,0,0,0,0,0,0,0,0,4641,57291485507c69054da8e59a,Pixel Dungeon,1.9.2a,Niranjan Kartha,28.12.15,5,Great Love it. Better than the stupid remakes who claim to improve it.
0,0,0,0,0,0,0,0,0,0,0,0,0,4642,57291488507c69054da8e59b,Pixel Dungeon,1.9.2a,Adrian Foo,28.12.15,5,so tough so good perfect game to play whilst waiting for people
0,0,0,0,0,0,0,0,0,1,0,0,0,4643,57291488507c69054da8e59c,Pixel Dungeon,1.9.2a,Sny Rgy,28.12.15,5,"Wow Couldn't ask for a better free game. The mechanics are good, the music is outstanding, the classes are wonderful and the difficulty is soul-crushingly awesome/appropriate. 10/10 would (and will) die again"
0,0,0,0,0,0,0,0,0,0,0,0,0,4644,57291488507c69054da8e59d,Pixel Dungeon,1.9.2a,Jordan Hendricks,28.12.15,5,Fun and challenging. The maps and items change every time you die.
0,0,0,0,0,0,0,0,0,0,0,0,0,4645,57291488507c69054da8e59e,Pixel Dungeon,1.9.2a,Xhejms Xhura,28.12.15,5,Best game ever Really like this game _ÙÔ
0,0,0,0,0,0,0,0,0,0,0,0,0,4647,5729148b507c69054da8e5a0,Pixel Dungeon,1.9.2a,Deon Lillo,27.12.15,5,Amazing Game This is such an amazing game and the challenge makes it super fun!!!! I love this game!!!! _Ù÷ã_Ù÷ _ÙÔ_ÙÔ
0,0,0,0,0,0,0,0,0,0,0,0,0,4648,5729148b507c69054da8e5a1,Pixel Dungeon,1.9.2a,Joseph Won,27.12.15,5,Awesome Great game! Played for hours still cant beat it i guess only for pros? Lol ;) a suggestion I would make is if there can be a update with pets? That to me seems pretty cool B-)
0,0,0,0,0,0,0,0,0,0,0,0,0,4649,57291490507c69054da8e5a2,Pixel Dungeon,1.9.2a,Marcos Morales Carlson,26.12.15,3,"Huntress needs a buff Overall a good game but the huntress needs some sort of buff to make her stronger. I've gotten to depth 20+ on every other character except for the huntress, I've never gotten past depths 3-5 with her yet."
0,0,0,0,0,0,0,0,0,0,0,0,0,4650,57291490507c69054da8e5a3,Pixel Dungeon,1.9.2a,A Google User,26.12.15,5,"Great game for any platform... ...let alone the mobile phone! Such a great reboot of the roguelike genre. Faithful to the best of Rogue spirit while definitely modern, with more of everything and rather pretty 2D graphics. My favourite Android game."
0,1,0,0,0,0,0,0,0,0,0,0,0,4651,57291492507c69054da8e5a7,Pixel Dungeon,1.9.2a,Rockie Game Over,25.12.15,5,"Great Game!!! Never the same map. Also play it on PC too!! Love this, easy to play. Auto save, can put down anytime."
0,0,0,0,0,0,0,0,0,0,0,0,0,4652,57291492507c69054da8e5a8,Pixel Dungeon,1.9.2a,Jared Shapiro,25.12.15,4,"Like it a lot. Great game but I wish I could save my progress. I die very easily, and haven't figured out a system."
0,1,0,0,0,0,0,0,0,0,0,0,0,4653,57291494507c69054da8e5aa,Pixel Dungeon,1.9.2a,Michael O'Rourke,25.12.15,5,Such a simple thing but SO fun
0,0,0,0,0,0,0,0,0,0,0,0,0,4654,57291494507c69054da8e5ab,Pixel Dungeon,1.9.2a,Katelyn Tewell,25.12.15,5,I think that this game is so good and fun
0,0,0,0,0,0,0,0,0,0,0,0,0,4655,5729149f507c69054da8e5ad,Pixel Dungeon,1.9.2a,Nuruddin Peters,24.12.15,5,"Game of the year - 2015 Nerf those monks please. They are seriously the most broken enemy in the game. Next-in-line, Orc Warlocks."
0,0,0,0,0,0,0,0,0,0,0,0,0,4656,5729149f507c69054da8e5ae,Pixel Dungeon,1.9.2a,kirsten simmons,24.12.15,1,Borring! I am so booored
0,0,0,0,1,0,0,0,0,0,0,0,0,4658,5729149f507c69054da8e5b0,Pixel Dungeon,1.9.2a,Christhopher Dubrick,24.12.15,5,HTC One M9 Really good.
0,0,0,0,0,0,0,0,0,0,0,0,0,4660,572914a2507c69054da8e5b2,Pixel Dungeon,1.9.2a,Mookie Silverhorn,23.12.15,3,Ugh.. Its kinda Addicting but also its frustrating! I wnna buy items so I don't die as much and I drunk a potion that killed me like wtf
0,1,0,0,0,0,0,0,0,0,0,0,1,4661,572914a6507c69054da8e5b3,Pixel Dungeon,1.9.2a,Brantson Yeaman,23.12.15,5,"Highly recommend it. Quality game. The art is clean, informative, and uniform in style. The interface is intuitive and nonobtrusive. The gameplay is what you would expect from a rogue like; a challenging experience with variety and replayability. Some people may find the permadeath concept frustrating at first, but i think it works really well, especially on a mobile game. I think it the characters feel a little too similar in playstyle, but otherwise this game is very complete, rather bug free, and a very good game overall."
0,0,0,0,0,0,0,0,0,0,0,0,0,4662,572914a6507c69054da8e5b4,Pixel Dungeon,1.9.2a,Ahmed Mahmoud,23.12.15,5,It is superb THIS GAME IS COOOOL. IT IS INCREDIBLE.
0,0,0,0,0,0,0,0,0,0,0,0,0,4663,572914a6507c69054da8e5b5,Pixel Dungeon,1.9.2a,Danielle Bradford,23.12.15,5,The maze is hard and I died but the graphics are great
0,0,0,0,0,0,0,0,0,0,0,0,0,4664,572914a9507c69054da8e5b8,Pixel Dungeon,1.9.2a,Alex Souvannasing,22.12.15,5,Love Hate This game is so much fun but is hard as heck to beat!
0,0,0,0,0,0,0,0,0,0,0,0,0,4665,572914ae507c69054da8e5b9,Pixel Dungeon,1.9.2a,carson vallino,22.12.15,4,"Solid game from someone who played the original This game is like the original style of dungeon diving turned based adventure but with a few cool additions and animation.... Its not as good as the original by far IF YOU LIKE THIS GAME I HIGHLY HIGHLY RECOMMEND THAT YOU PLAY NETHACK FOR THE ANDRIOD blows this game out of the water difficulty and content wise. One last thing, there is not enough food in the game to survive for an extended period of time on any floor"
0,0,0,0,0,0,0,0,0,0,0,0,0,4666,572914ae507c69054da8e5ba,Pixel Dungeon,1.9.2a,Zach Plant,22.12.15,5,Great game Good way to pass the time
0,1,0,0,0,0,0,0,0,0,0,0,1,4667,572914b2507c69054da8e5bb,Pixel Dungeon,1.9.2a,Wong Leon Kai,22.12.15,5,"Simple and challenging Pretty hard, as I only made it to Level 5 about 4 or 5 times after a week of downloading it, but I just like the simpleness of the game. The controls are easy to follow, unlike other games where you have to use some complex joystick thing. And the scrolls and the potions are pretty simple to guess of their effects just by looking at the names. And since every game is different, every game I play will always keep me hooked and ready to kick some rat butt."
0,0,0,0,0,0,0,0,0,0,0,0,0,4668,572914b2507c69054da8e5bc,Pixel Dungeon,1.9.2a,Christofer BÌ_cklin,22.12.15,5,"New take on dungeon crawling Spent lots of time playing. Well made and has a few really cool features, like the random scrolls and potions."
0,0,0,0,0,0,0,0,0,0,0,0,0,4669,572914b2507c69054da8e5bd,Pixel Dungeon,1.9.2a,Eric Skrezyna,22.12.15,5,Wow it's really fun
0,0,0,0,0,0,0,0,0,0,0,0,0,4670,572914b4507c69054da8e5bf,Pixel Dungeon,1.9.2a,Gaming Master,21.12.15,5,"Best rpg game of the year 2015 Good graphics,gameplay and game itself"
0,0,0,0,0,0,0,0,0,0,0,0,0,4671,572914b4507c69054da8e5c0,Pixel Dungeon,1.9.2a,Jerin Bond,21.12.15,5,Really fun
0,0,0,0,0,0,1,0,0,1,0,0,0,4672,572914bb507c69054da8e5c2,Pixel Dungeon,1.9.2a,Cub 1,21.12.15,5,"Awesomeness One of the best games I've ever played. No stupid in app purchases (it doesn't have them, Play Store said so because you can make a completely optional donation) no ridiculous waiting times, no ads, no pay walls. And the game is really great and not repetitive because of random generation. It's quite difficult but challenging and rewarding, so If you haven't already got it download it now! Please don't rate it bad for permadeath. It's a roguelike."
0,0,0,0,0,0,0,0,0,0,0,0,0,4673,572914bb507c69054da8e5c3,Pixel Dungeon,1.9.2a,Karissa Soo,20.12.15,5,"This is my absolute favorite game. Ever. Seriously though. I wish it were a bit more complex, like Nethack or even ToME or Cataclysm, but nobody seems to have successfully adapted those to an ergonomic mobile interface, so Pixel Dungeon is always my number one choice if I've got some time to kill (and even if I don't, haha). Definitely a game I am proud to play and evangelize about."
0,0,0,0,0,0,0,0,0,0,0,0,0,4674,572914bf507c69054da8e5c4,Pixel Dungeon,1.9.2a,Ricardo Vargas,19.12.15,4,"Pixel dungeon Pretty awesome, pretty tough."
0,1,0,0,0,0,0,0,0,1,0,0,1,4675,572914bf507c69054da8e5c5,Pixel Dungeon,1.9.2a,Jacopo Bertolotti,19.12.15,5,"Deceptively simple and hugely playable. Just beware that this game is merciless: a single mistake, or even just a single stroke of bad luck, and you are history. No saving your progress or helping hand here. As an added bonus this game is truly free to play. No in-game purchase of any kind to bother you or to offer an easy way out of a tricky situation. Just a very unobtrusive button to donate. Kudos to the developers for a job well done."
0,0,0,0,0,0,0,0,0,0,0,0,0,4676,572914c2507c69054da8e5c9,Pixel Dungeon,1.9.2a,bubbly bubble,18.12.15,5,It's gr8 Eh m8 its gr8 I r8 8/8 no b8 but end with f8 made me lose w8
0,0,0,0,0,0,0,0,0,0,0,0,0,4677,572914c5507c69054da8e5cb,Pixel Dungeon,1.9.2a,Nicholas S,17.12.15,5,"Awesome Long time RPG/Dungeon Crawler junkie, and I have to say that this game DOES NOT disappoint! Tons of fun!! Processorops to the developers :)"
0,0,0,0,0,0,0,0,0,0,0,0,0,4678,572914cc507c69054da8e5cd,Pixel Dungeon,1.9.2a,Caylon Smith,17.12.15,5,Best game ever
0,0,0,0,0,0,0,0,0,0,0,0,0,4679,572914cf507c69054da8e5cf,Pixel Dungeon,1.9.2a,Aaron Bond,16.12.15,5,if you like roguelike gameplay very polished and competent modern roguelike. tough as nails. hard like games of old.
0,0,0,0,0,0,0,0,0,0,0,0,0,4680,572914cf507c69054da8e5d0,Pixel Dungeon,1.9.2a,Default Gaming,15.12.15,4,Great game but difficult Yup...
0,1,0,0,0,0,0,0,0,0,0,0,0,4681,572914cf507c69054da8e5d1,Pixel Dungeon,1.9.2a,Anthony Finocchiaro,15.12.15,5,Great game It's really easy to use
0,0,0,0,0,0,0,0,0,0,0,0,0,4682,572914cf507c69054da8e5d2,Pixel Dungeon,1.9.2a,Avatar Of Loneliness,15.12.15,5,"Decent rpg This game is an old school rpg with the good old pixel graphic. The game randomly choose a dungeon and throws you in it, all the things you find inside the dungeon is different every time. There are also no save game system which is pretty good as a challenge compare to the modern rpg."
0,0,0,0,0,0,0,0,0,0,0,0,0,4683,572914d2507c69054da8e5d3,Pixel Dungeon,1.9.2a,American Zax,14.12.15,5,Watabou there is a pixel dungeon rip off called pixel underworld just wanted to warn u
0,0,0,0,0,0,0,0,0,0,0,0,0,4684,572914d2507c69054da8e5d5,Pixel Dungeon,1.9.2a,Elad Amon,14.12.15,5,One of the best games on the Play Store. 11/10 would dungeon again.
0,0,0,0,0,0,0,0,0,0,0,0,0,4685,572914e0507c69054da8e5d6,Pixel Dungeon,1.9.2a,Joaquin Lanusse,13.12.15,5,"Das RPG Wonderful, addicting. Will have your soul."
0,0,0,0,0,0,0,0,0,0,0,0,0,4686,572914e0507c69054da8e5d7,Pixel Dungeon,1.9.2a,Ollie Duffy,13.12.15,1,LOL nah. 1 life system.
0,0,0,0,0,0,1,0,0,0,0,0,0,4687,572914e0507c69054da8e5d8,Pixel Dungeon,1.9.2a,michael k,12.12.15,5,"GREATEST GAME EVER RELEASED ON MOBILE Perfect game. It's suprisingly in-depth, ad free, strategic, and addicting in the best way possible. Even the underlying story is really good! The game as a whole brings about a feeling of nostalgia echoing from memories of plundering dungeons in the original legend of zelda. Really difficult until you figure out that you don't mess with giant piranhas EVER. My only regret is finding this game the week before finals. This game has made me question my decision to prioritize college over anything else. 10/10"
0,0,0,0,0,0,0,0,0,0,0,0,0,4688,572914e5507c69054da8e5d9,Pixel Dungeon,1.9.2a,billy clarke,12.12.15,5,"Good Job With It Guys Nice, I Really Love How The Game Works And Plays Out. I'm Hoping To See More Things In The future If There Will Be, Anyways Good Game Guys"
0,0,0,0,0,0,0,0,0,0,0,0,0,4689,572914e5507c69054da8e5da,Pixel Dungeon,1.9.2a,Fiqri Fiqri,12.12.15,5,Great game! The best roguelike game in Android!!
0,0,0,0,0,0,0,0,0,0,0,0,0,4690,572914e5507c69054da8e5db,Pixel Dungeon,1.9.2a,Fluxxe,12.12.15,5,The best game Ive had this game since it only had I think 15 - 20 levels so I waited for an update but it never came a couple years later I re-dowloaded this and I love it so many levels way better than the old one and the best time to killer I love it
0,0,0,0,0,0,0,0,0,0,0,0,0,4691,572914e9507c69054da8e5dc,Pixel Dungeon,1.9.2a,Zack Just.Zack,11.12.15,5,Top game I play it when I am bored and man It kills boredom like a lightening ^-^
0,0,0,0,0,1,0,1,0,1,0,0,0,4692,572914e9507c69054da8e5dd,Pixel Dungeon,1.9.2a,Max Lague,11.12.15,5,"Phenomenal! This brings together everything I am looking for on a mobile device. It is free, it takes up virtually no storage, it doesn't need WiFi to play, it is an excellent game, and it doesn't constantly hound you with advertisements and IAP deals."
0,0,0,0,0,0,0,0,0,0,0,0,0,4693,572914e9507c69054da8e5de,Pixel Dungeon,1.9.2a,Isaiah Navarro,11.12.15,5,"So fun Addicting, great game to pass time if bored."
0,0,0,0,0,0,0,0,0,0,0,0,0,4694,572914e9507c69054da8e5df,Pixel Dungeon,1.9.2a,Nick Radd,11.12.15,5,Spicy
0,0,0,1,0,0,0,0,0,0,0,0,0,4695,572914ec507c69054da8e5e0,Pixel Dungeon,1.9.2a,Ben Parker,10.12.15,2,Fun but... There were so many glitches that it made the game not worth playing.
0,0,0,0,0,0,0,0,0,0,0,0,0,4696,572914ec507c69054da8e5e1,Pixel Dungeon,1.9.2a,max mcpherson,10.12.15,5,m8 i rate it 10/10
0,0,0,0,0,0,0,0,0,1,0,0,1,4697,572914ec507c69054da8e5e2,Pixel Dungeon,1.9.2a,Joseph Ware,09.12.15,5,"Fantastic! Pixel Dungeon is one of the best mobile games I've played! It has beautiful retro aesthetics, and very well designed roguelike gameplay! The masterful use of procedural generation blows the replay value through the roof, and did I mention that this great game is completely free? That's right. Completely. No upfront price, and no ingame purchases. None of that. You are given the option to donate $5, but that's it!"
0,0,0,0,0,0,0,0,0,0,0,0,0,4698,572914ef507c69054da8e5e4,Pixel Dungeon,1.9.2a,Iisakki Jaakkola,08.12.15,4,"PD has gotten easier New patches involve new ways to kill your way through the dungeon but monsters remain the same. """"""""Scroll of wipe out"""""""" shouldn't exist... I understand that these changes make playing more enjoyable for beginners but they affect the lategame way too much."
0,0,0,0,0,0,0,0,0,0,0,0,0,4699,57291565507c69054da8e5e6,Pixel Dungeon,1.9.2a,Jacob Waters,08.12.15,5,"Best Game On Android! If you find this game excessively challenging, that's because it is! If you ever get the Amulet Of Yendor, as I have after a year of playing, you will feel like a boss! The Huntress-Sniper is the best class, your upgradable boomerang your only ally. Search every blank tile, use weightstones to keep you boomerang from breaking, save three magic mapping scrolls for levels 22-24, save a potion of paralysis for the burning fist & rotting hand, and have a battle-wand for the Eye at the end. Play till you win!"
0,0,0,0,0,0,0,0,0,0,0,0,0,4700,57291568507c69054da8e5e9,Pixel Dungeon,1.9.2a,Minecraft Ninja,08.12.15,5,Love it ‰_ ‰_ ‰_ Can only make it to goo kill him then i die draw. Check out my youtube Minecraft-ninja9001!
0,0,0,0,0,0,0,0,0,0,0,0,0,4701,57291568507c69054da8e5ea,Pixel Dungeon,1.9.2a,David Mera,08.12.15,5,Really fun and addictive If dungeon crawling and rogue-like elements is something you look for this game is for you
0,0,0,0,0,0,1,0,0,0,0,0,0,4702,5729156b507c69054da8e5eb,Pixel Dungeon,1.9.2a,John Moore,08.12.15,5,"Fun and simple No ads, challenging but fun, great way to waste some time, easy to pick up and put down. Great little game!"
0,0,0,0,0,0,0,0,0,0,0,0,1,4705,5729156f507c69054da8e5ee,Pixel Dungeon,1.9.2a,Benoit Bataille,07.12.15,2,"Used to be one of the best roguelike I ever played with balanced, simple and enjoyable mechanics and tight design. Perfect for a break on your phone. Then the author decided people were having bad-good fun and ruined the game with update 1.7.4. Avoid and play rather one of the now much better fork."
0,1,0,0,0,0,0,0,0,0,0,0,0,4706,5729156f507c69054da8e5ef,Pixel Dungeon,1.9.2a,Paul Magne Haakonsen,07.12.15,3,Fairly okay game... This dungeon crawl game is simple and fun enough. Except for the fact that there is NEVER enough food to stop the hunger and it is the most frequently cause of death in the game. Which is a major nuisance to an otherwise good game.
0,0,0,0,0,0,0,0,0,0,0,0,0,4707,57291572507c69054da8e5f0,Pixel Dungeon,1.9.2a,Liam O'Quin,07.12.15,1,Garbage Most unbalanced game I've ever played. High difficulty from the beginning instead of increasing difficulty with levels. Not fun.
0,0,0,0,0,0,0,0,0,0,0,0,0,4708,57291572507c69054da8e5f2,Pixel Dungeon,1.9.2a,Noah Langhammer,07.12.15,1,Hate it! It's not fun at all.
0,0,0,0,0,0,1,0,0,0,0,0,0,4709,57291576507c69054da8e5f3,Pixel Dungeon,1.9.2a,Aj Richardson,07.12.15,5,Great Open Source Rpg Retro Graphics. Mods. So much to love.
0,0,0,0,0,0,0,0,0,0,0,0,0,4710,57291576507c69054da8e5f5,Pixel Dungeon,1.9.2a,Eddie Hernandez,06.12.15,5,Love it So much fun but I normally die from hunger because there isn't much food. Still a great game
0,0,0,0,0,0,0,0,0,0,0,0,0,4711,57291579507c69054da8e5f8,Pixel Dungeon,1.9.2a,Stinkert YoÌÇl,06.12.15,4,"Nice Extremely hard to play, better equipment in the beginning wouldve be greatly appreciated."
0,0,0,0,0,0,0,0,0,0,0,0,0,4713,5729157c507c69054da8e5fb,Pixel Dungeon,1.9.2a,Benjamin WÌ_nglund,06.12.15,4,"Very fun Good timekiller, altough i find myself kind of stuck, always dying and not really reaching any further."
0,0,0,0,0,0,0,0,0,0,0,0,0,4714,5729157c507c69054da8e5fc,Pixel Dungeon,1.9.2a,Jerry Marhz,06.12.15,5,Probably the best dungeon rogue ever made! Addictive and unforgiving! Pixel Dungeon sets the mark by which all others are compaired...
0,0,0,0,0,0,0,0,0,0,0,0,0,4715,5729157c507c69054da8e5fd,Pixel Dungeon,1.9.2a,Ruby Hobson,06.12.15,1,I don't like it
0,0,0,0,0,0,0,0,0,0,0,0,0,4716,5729158b507c69054da8e5fe,Pixel Dungeon,1.9.2a,Jake Fritz,06.12.15,5,"Best mobile rpg Awesome game, great way to kill time"
0,0,0,0,0,0,0,0,0,0,0,0,0,4717,5729158b507c69054da8e5ff,Pixel Dungeon,1.9.2a,Ravinz,06.12.15,4,"It's not something you want to get bored off Just asthe title said, really immersive and fun, that you'll want to play again, again, and again."
0,0,0,0,0,0,0,0,0,0,0,0,0,4718,5729158b507c69054da8e600,Pixel Dungeon,1.9.2a,Alfonso Tarantini,06.12.15,4,"Degradation is bad Game almost impossibile now. Removes the pleasure of collecting items and forces you to ""manage"" your rare scrolls of upgrade, which distracts you from the gaming experience."
0,0,0,0,0,0,1,0,0,0,0,0,0,4719,5729158f507c69054da8e602,Pixel Dungeon,1.9.2a,Jason Garnham,05.12.15,5,"I've missed this! I used to play rogue games 15-20 years a go, and this has all the fun, frustration, and tactical requirements the old ones did. Great job! A bonus that it doesn't rely on a data link or pester you with ads. A HUGE bonus! Worth donating to the developers."
0,0,0,0,0,0,0,0,0,0,0,0,0,4720,5729158f507c69054da8e603,Pixel Dungeon,1.9.2a,Ali Eser,05.12.15,5,Best Best
0,0,0,0,0,0,0,0,0,0,0,0,0,4721,57291592507c69054da8e604,Pixel Dungeon,1.9.2a,Zain Samie,05.12.15,5,"Hey, you there! Developers, here take 5 stars because you deserve it."
0,0,0,0,0,0,0,0,0,0,0,0,0,4722,57291592507c69054da8e606,Pixel Dungeon,1.9.2a,Josey Zo,05.12.15,5,N3ver leaves my phone Fun
0,0,0,0,0,0,0,0,0,0,0,0,0,4723,57291595507c69054da8e609,Pixel Dungeon,1.9.2a,Dave Dumont,05.12.15,5,"Pixel Perfection I stumbled onto this masterpiece while searching for a decent RPG to play. I was hooked instantly, and it's now my all time favorite game! I had a friend from work check it out, and he has been playing it ever since. What's up Miguel? :D"
0,0,0,0,0,0,0,0,0,0,0,0,0,4724,57291598507c69054da8e60b,Pixel Dungeon,1.9.2a,map0wt0fu,05.12.15,5,Great rogue like to play on the fly. Expect lots of fun death and frustration.
0,0,0,0,0,0,0,0,0,0,0,0,0,4725,57291598507c69054da8e60c,Pixel Dungeon,1.9.2a,Micheal Donnelly,05.12.15,5,Ohh man! Essential an endless rpg machine. I LOVE this game.
