IS_ANDROID VERSION,IS_APP USABILITY,IS_BATTERY,IS_COMPLAINT,IS_DEVICE,IS_HARDWARE,IS_LICENSING,IS_MEMORY,IS_PERFORMANCE,IS_PRICE,IS_PRIVACY,IS_SECURITY,IS_UI,Unnamed: 0,_id,app,appVersion,author,date,ratingStars,reviewText
0,1,0,0,0,0,0,0,0,0,0,0,0,7636,578949ad819cb706b00a77d4,Wally,01.06.01,Lionel Gettliffe-Rudling,05.05.16,5,Pretty Easy to use with lots of pretty pics.
0,0,0,0,0,0,0,0,0,0,0,0,0,7637,578949ac819cb706b00a77d1,Wally,01.06.01,punit manocha,06.05.16,1,Force close Force close. force close. force close. _Ù÷Ê_Ù÷Ê_Ù÷Ê_Ù÷Ê_Ù÷Ê_Ù÷Ê_Ù÷Ê_Ù÷Ê
0,0,0,0,0,0,0,0,0,0,0,0,0,7638,578949aa819cb706b00a77cb,Wally,01.06.01,Uday Sam,07.05.16,5,"Awesome! I just love this app, there's great content, almost everything I need !"
0,0,0,1,0,0,0,0,0,0,0,0,0,7639,578949aa819cb706b00a77cc,Wally,01.06.01,Abhishek Neogy,07.05.16,2,Crashes every time This was my favourite app but now i can't use this app
0,0,0,1,0,0,0,0,0,0,0,0,0,7640,578949aa819cb706b00a77cd,Wally,01.06.01,Sudarshan Chauhan,07.05.16,4,"Great app It's a nice app, just fix the crashing n errors."
0,0,0,1,0,0,0,0,0,0,0,0,1,7641,578949aa819cb706b00a77ce,Wally,01.06.01,Billy Karim,07.05.16,2,Was great... Crashes opening any wallpapers. Have uninstalled and reinstalled - same outcome.
0,0,0,1,0,0,0,0,0,0,0,0,0,7642,578949ac819cb706b00a77cf,Wally,01.06.01,Yash Patil,07.05.16,2,Crash Always crash fix this problem
0,0,0,1,0,0,0,0,0,0,0,0,0,7643,578949ac819cb706b00a77d0,Wally,01.06.01,Fabien Girardin,07.05.16,2,Can't save anymore Was crashing from time to time but now I can't even save pics! The DL bar keeps going until it crashes. Please fix
0,0,0,1,1,0,0,0,0,0,0,0,0,7644,578949a8819cb706b00a77c9,Wally,01.06.01,Siam Abrar,09.05.16,4,Loading Issue again (galaxy note 5) For a day or two I got it well working with few crashes that I assumed as neglegible. But the same problem rose again. It loads on my other devices as well. It loads and loads until I uninstall or close the app. Its already months and you are not fixing the issue. I cant find a better wallpaper app in the playstore rather than this. If you dont want to fix this issue please remove it from the store so that I can stop relying on the day that it will be fixed.
0,0,0,1,0,0,0,0,0,0,0,0,0,7645,578949a8819cb706b00a77c8,Wally,01.06.01,Belden Suboh,11.05.16,1,Always crash... Keeps crashing all the time... please fix... by far the best wallpaper provider I've ever used. More stars when rectified...
0,0,0,1,0,0,0,0,0,0,0,0,0,7646,578949a5819cb706b00a77c7,Wally,01.06.01,Rizwan Basir,12.05.16,1,Crashing all over the place.
0,0,0,1,0,0,0,0,0,0,0,0,0,7647,578949a3819cb706b00a77c4,Wally,01.06.01,Robert Dziedzic,13.05.16,5,Edit: Stopped crashing after I left a review....lol Crashes every time I try to pick a wallpaper. Edit: doesn't crash anymore
1,0,0,1,1,0,0,0,0,0,0,0,0,7648,578949a5819cb706b00a77c5,Wally,01.06.01,gintu tom,13.05.16,4,Great! This is the best wallpaper app I have ever used. But after the recent update it crashes so frequently almost making it impossible to use. Developer please have a look into this matter.I use ASUS ZenFone 5 with kitkat 4.4.
0,0,0,1,0,0,0,0,0,0,0,0,0,7649,578949a5819cb706b00a77c6,Wally,01.06.01,Low Step,13.05.16,2,Not working It is a good app but now it is not working and shows the messege unfortunately wally has stopped working !! Fix this problem plz i m addicted to it _Ù÷Ð
1,1,0,1,1,0,0,0,0,0,0,0,0,7650,578949a1819cb706b00a77c0,Wally,01.06.01,I O,14.05.16,4,"Great app but crashes This has amazing wallpapers and is easy to use, but like others, I am getting crashing pretty often. Most often it happens when previewing a wallpaper. I am using S7 edge with Android version 6.01."
0,0,0,1,0,0,0,0,0,0,0,0,0,7651,578949a3819cb706b00a77c1,Wally,01.06.01,Mohammad Tazdir Ahmed,14.05.16,1,Crash Crash and Crash Total failure.
0,0,0,0,0,0,0,0,0,0,0,0,0,7652,578949a3819cb706b00a77c2,Wally,01.06.01,Josh Rhame,14.05.16,1,Constant FC.
0,0,0,0,0,0,0,0,0,0,0,0,0,7653,578949a3819cb706b00a77c3,Wally,01.06.01,FalseDeath !,14.05.16,1,keeps on closing _Ù÷¢
0,0,0,1,1,0,0,0,0,0,0,0,0,7654,578949a1819cb706b00a77bf,Wally,01.06.01,Aakash Das,15.05.16,1,Coolpad Note 3 What happened to this app?It keeps crashing always!?
1,0,0,1,1,0,0,0,0,0,0,0,0,7655,578949a1819cb706b00a77be,Wally,01.06.01,Konstantin Tchernov,16.05.16,1,Too crashy Too crashy on Android 6 Nexus 5.
0,0,0,1,0,0,0,0,0,0,0,0,0,7656,5789499f819cb706b00a77bb,Wally,01.06.01,Shushant Poojari,17.05.16,2,"Its just keep on crashing!! Worst aap ever, fix it.."
0,0,0,1,1,0,0,0,1,0,0,0,0,7657,5789499f819cb706b00a77bc,Wally,01.06.01,Eric MacÌ_as Palacios,17.05.16,4,"Awesome application but it makes my note 4 crash and freeze every 2 images, pleas fix it"
0,0,0,0,0,0,0,0,0,0,0,0,0,7658,578949a1819cb706b00a77bd,Wally,01.06.01,Manash Malakar,17.05.16,2,"Its crashed On my lenovo 7000 turbo...its crashed every time, pls check & solve it asap."
0,0,0,1,0,0,0,0,0,0,0,0,1,7659,5789499f819cb706b00a77b9,Wally,01.06.01,John Kosmetos,18.05.16,2,"App Keeps Crashing The app keeps crashing, I can barely browse any wallpapers."
0,0,0,1,0,0,0,0,0,0,0,0,1,7660,5789499f819cb706b00a77ba,Wally,01.06.01,Aditya Roy,18.05.16,3,Crashes after clicking on images Needs an update
0,0,0,0,0,0,0,0,0,0,0,0,0,7661,5789499d819cb706b00a77b8,Wally,01.06.01,Ayush Pandey,19.05.16,4,Solid Wallpaper App One of the best wallpaper app out there. Quality is absolutely great. It's just that it lacks any rating system or greater number of apps.
0,1,0,1,0,0,0,0,0,0,0,0,1,7662,5789499d819cb706b00a77b6,Wally,01.06.01,Jarvis Wen,20.05.16,3,"The wallpapers‰Ûª sizes aren't match Well...The design of the app is good and it's easy to find wallpapers, but the scales of wallpapers are always not match my phone."
1,0,0,1,0,0,0,0,0,0,0,0,1,7663,5789499d819cb706b00a77b7,Wally,01.06.01,George Sariev,20.05.16,3,"Crashes I love this app, but after the marshmallow update, I've been having crashes every time I want to view a wallpaper."
0,0,0,1,0,0,0,0,0,0,0,0,0,7664,5789499a819cb706b00a77b3,Wally,01.06.01,Dushan Janeski,21.05.16,1,"It looks great,it works great but it crashes a lot every few wallpapers...please fix it"
0,0,0,1,0,0,0,0,0,0,0,0,1,7665,5789499a819cb706b00a77b4,Wally,01.06.01,PRUTHVIRAJ BARAD,21.05.16,2,Can't view full image it crashes
0,0,0,1,0,0,0,0,0,0,0,0,0,7666,5789499a819cb706b00a77b5,Wally,01.06.01,Martin Babaran,21.05.16,3,Great app but crashes after ~10 secs of viewing I tried restarting the phone but it didn't fix the problem.
0,0,0,1,0,0,0,0,0,0,0,0,0,7667,5789499a819cb706b00a77b2,Wally,01.06.01,Mr. Sky Shark,22.05.16,1,Crash Crash all time
0,0,0,1,0,0,0,0,0,0,0,0,0,7668,57894998819cb706b00a77b1,Wally,01.06.01,hritik th,23.05.16,1,Disappointed U guys really... I mean really f**** your product.... Its just keeps on force closing!
0,0,0,1,0,0,0,0,0,0,0,0,1,7669,57894995819cb706b00a77ad,Wally,01.06.01,Phillip Worthington,24.05.16,3,Crashes a lot. Sometimes requires multiple touchs to download
0,0,0,1,0,0,0,0,0,0,0,0,0,7670,57894995819cb706b00a77af,Wally,01.06.01,Piyush Soni,24.05.16,1,Getting crashed a lot plz help
0,0,0,0,0,0,0,0,0,0,0,0,0,7671,57894995819cb706b00a77b0,Wally,01.06.01,Alex Hein,24.05.16,5,"My favorite wallpaper app Huge selection, (biggest I've encountered) all themes, styles & categories. Effective & handy search feature. I need not say more."
0,0,0,1,0,0,0,0,0,0,0,0,0,7672,57894992819cb706b00a77a7,Wally,01.06.01,kritvirya singh,26.05.16,3,needs improvement
0,0,0,1,0,0,0,0,0,0,0,0,0,7673,57894992819cb706b00a77a8,Wally,01.06.01,zain alabedien,26.05.16,3,Crashes everi tiem ! The wallpapers are just fantastic! This app is all in all high quality but Come on! It crashes now every few seconds?? Please fix it
0,0,0,1,0,0,0,0,0,0,0,0,1,7674,57894994819cb706b00a77a9,Wally,01.06.01,Robert Guyton,26.05.16,1,"Crashes Was great but for past few months crashes when you tap on 70 percent of thumbnails.Gives message """"""""Unfortunately Wally has stopped."""""""""
0,0,0,1,0,0,0,0,0,0,0,0,0,7675,57894994819cb706b00a77aa,Wally,01.06.01,Jv Sandhu,26.05.16,1,i love it but man it's crashing all over the place still
0,0,0,1,0,0,0,0,0,0,0,0,1,7676,57894994819cb706b00a77ab,Wally,01.06.01,David Marrast,26.05.16,2,Would be amazing... Would be perfect If it didn't always crash whenever I attempted to preview most images. Very annoying.
0,0,0,1,1,0,0,0,0,0,0,0,0,7677,57894991819cb706b00a77a4,Wally,01.06.01,usman ali,27.05.16,5,Loved it but hate it now I don't know ...this is the best wallpaper app i ever use but recently it is crashing all the time nexus 6p..
0,0,0,0,0,0,0,0,0,0,0,0,0,7678,57894992819cb706b00a77a5,Wally,01.06.01,Juan Monsalve,27.05.16,4,4 stars for Wallhaven!
0,0,0,1,1,0,0,0,0,0,0,0,0,7679,57894992819cb706b00a77a6,Wally,01.06.01,Miso Ranusa,27.05.16,1,I have craches even after reinstalling this app on Sony Xperia z3+
0,0,0,1,0,0,0,0,0,0,0,0,1,7680,57894991819cb706b00a77a1,Wally,01.06.01,Patrick Henry,28.05.16,4,Been crashing after few minutes Nice app clean and purposeful but crashes at times for no reason and wallpapers disappear /delete at times
0,0,0,1,0,0,0,0,0,0,0,0,0,7681,57894991819cb706b00a77a2,Wally,01.06.01,JAVED JILANI,28.05.16,3,Not working for long time Good app but not work properly.....
0,0,0,1,0,0,0,0,0,0,0,0,0,7682,57894991819cb706b00a77a3,Wally,01.06.01,Wael Armani,28.05.16,1,Constantly crashes
0,0,0,1,0,0,0,0,0,0,0,0,0,7683,57894989819cb706b00a779d,Wally,01.06.01,ÌâmÌ¬Ì©ª Waiba 0_o,29.05.16,2,It keeps insanely crashing
0,0,0,1,0,0,0,0,0,0,0,0,0,7684,57894989819cb706b00a779e,Wally,01.06.01,Akshay Sagar,29.05.16,3,Awesome It's the best app I found for wallpapers but crashes too much
0,0,0,1,0,0,0,0,0,0,0,0,0,7685,57894989819cb706b00a779f,Wally,01.06.01,Aditya Sharma,29.05.16,2,"Unfortunately, Wally has stopped. Plz make it stop from crashing again and again"
0,0,0,1,1,0,0,0,0,0,0,0,0,7686,57894989819cb706b00a77a0,Wally,01.06.01,abdulmalik al-harbi,29.05.16,1,Xepria Z2 Crashs alot !!! Every single minute!!
0,0,0,1,0,0,0,0,0,0,0,0,0,7687,57894989819cb706b00a779c,Wally,01.06.01,David S,30.05.16,1,Totally broken now.
0,0,0,1,0,0,0,0,0,0,0,0,0,7688,57894988819cb706b00a7799,Wally,01.06.01,Suyash Kamble,31.05.16,2,"Was good Wally was my goto it was perfect the size of the app, resolution ,categories. But its sucks now it crashes every minute that is sooooo frustrating need an update ASAP"
0,0,0,1,0,0,0,0,0,0,0,0,1,7690,57894988819cb706b00a7798,Wally,01.06.01,Ruben Garcia,01.06.16,2,Keeps crashing everytime I open a wallpaper
0,0,0,1,0,0,0,0,0,0,0,0,0,7691,57894986819cb706b00a7796,Wally,01.06.01,yunuz incredible,02.06.16,2,Crashing
0,0,0,1,0,0,0,0,0,0,0,0,0,7692,57894986819cb706b00a7797,Wally,01.06.01,Jonatan Olmos,02.06.16,3,Great but fix it. App used to be great now it keeps crashing almost every time I go on it
0,0,0,1,0,0,0,0,0,0,0,0,1,7693,57894986819cb706b00a7794,Wally,01.06.01,Mark Randol,03.06.16,1,"Works great when it's not crashing Crashes a lot when trying to view an image. When it works, really liked it."
0,0,0,1,0,0,0,0,0,0,0,0,0,7694,57894986819cb706b00a7795,Wally,01.06.01,Parth Tank,03.06.16,1,"Crashes one clicked on a wallpaper Title says it all , please fix this great app"
0,0,0,1,0,0,0,0,0,0,0,0,0,7695,57894984819cb706b00a7792,Wally,01.06.01,Mohammad zulfakar Manyari,05.06.16,1,Crashing again n again
0,0,0,1,1,0,0,0,0,0,0,0,1,7696,57894984819cb706b00a7793,Wally,01.06.01,David Riehl,05.06.16,3,"Awesome app, but crashes alot I love this app, but it keeps crashing whenever I open a wallpaper. This is happening on my HTC One M9. Could also have more 1440x2560 wallpapers (for making HTC themes)."
0,0,0,1,0,0,0,0,0,0,0,0,0,7697,57894984819cb706b00a7791,Wally,01.06.01,Ranga Priyan,06.06.16,4,Error!! Love this app but keeps crashing !!! Please update correcting it
0,0,0,1,0,0,0,0,0,0,0,0,1,7698,57894984819cb706b00a7790,Wally,01.06.01,Nate Pierce,07.06.16,1,"Most recent wallpapers are nothing but anime garbage, scrolling to try to get past it all just crashes the app. Not worth the effort"
1,0,0,1,1,0,0,0,0,0,0,0,1,7699,57894980819cb706b00a778b,Wally,01.06.01,amit bandyopadhyay,08.06.16,1,Crash when scroll down Please fix the issue when I browse and scroll down then crash Wally.i love this app. I'm used cyanogenmod 13 in my moto g 2015.
1,0,0,1,0,0,0,0,0,0,0,0,1,7700,57894980819cb706b00a778c,Wally,01.06.01,Akalanka Umayanga,08.06.16,1,"I loved this app! App is not working now. Android 5.1.1. """"""""Force Close"""""""" Every time when I open a image"
0,0,0,1,0,0,0,0,0,0,0,0,0,7701,57894982819cb706b00a778d,Wally,01.06.01,Suresh Chidambaram,08.06.16,1,Hero to Zero Did you guys test the app even once before pushing an update? It crashes all the time. I've sent like 100s of crash logs. Looks like the development has stopped for this app since you are to exit the alpha period. That's bad considering the huge number of your users.
0,0,0,1,0,0,0,0,0,0,0,0,0,7702,57894982819cb706b00a778e,Wally,01.06.01,Nagarajan Sekar,08.06.16,4,USED TO BE A GREAT APP It used to be a good app but now it has constant crashes.
0,0,0,1,0,0,0,0,0,0,0,0,0,7703,57894982819cb706b00a778f,Wally,01.06.01,Navneet Suresh,08.06.16,3,Awesome application. but crashes frequently.
1,0,0,1,1,0,0,0,0,0,0,0,1,7704,57894980819cb706b00a778a,Wally,01.06.01,Timothy Baker,10.06.16,1,Used to be my favorite :( Great app.. or at least it used to be. Literally crashes 7 out of 10 times I attempt to view a picture. Uninstalled. Galaxy S7 running Marshmallow.
0,0,0,1,1,0,0,0,0,0,0,0,0,7705,5789497e819cb706b00a7788,Wally,01.06.01,Ahamed Abumashaheen,11.06.16,4,"Good app The Application is pretty good, started to crash recently on the one plus one and the LG v10, other wise a good one!"
0,0,0,1,0,0,0,0,0,0,0,0,1,7706,5789497e819cb706b00a7789,Wally,01.06.01,Danial Lilley,11.06.16,1,Constant crashing Try to view a wallpaper? Crash. Try to download a wallpaper? Crash. Try to report the issue? Crash.
0,0,0,1,0,0,0,0,0,0,0,0,0,7707,5789497e819cb706b00a7787,Wally,01.06.01,Kristijan Puljek,12.06.16,4,Love it But it's constantly crashing
0,0,0,1,1,0,0,0,0,0,0,0,0,7708,5789497b819cb706b00a7785,Wally,01.06.01,David Campbell,13.06.16,1,Crashes all the time on HTC m9
0,0,0,1,0,0,0,0,0,0,0,0,0,7709,5789497b819cb706b00a7786,Wally,01.06.01,Rahul Xarma,13.06.16,1,Crashes
0,0,0,1,0,0,0,0,0,0,0,0,0,7710,5789497b819cb706b00a7783,Wally,01.06.01,chitman chatwal,15.06.16,3,App crash too much.you should fix this bug Add categories section in app.
0,0,0,1,0,0,0,0,0,0,0,0,0,7711,5789497b819cb706b00a7784,Wally,01.06.01,Shubhankar Mallick,15.06.16,4,The app in itself is quite good amazing high quality wallpapers but the issue with it it crashes so much makes it impossible to use.... Hope you could make it better
0,0,0,1,0,0,0,0,0,0,0,0,1,7712,5789497a819cb706b00a7782,Wally,01.06.01,Ansh Chaudhary,16.06.16,4,"Fine Nice app for anime lovers, I even told my friends about this app and posted on fb. There are a few problems though. Like when I put anime pictures to favorites and after that download them, I can't see there details like resolution and categories which is very important for me. It shows only 2 options, save as or wallpaper. It will be great if you people do something about this. And other thing is that the app force closes sometimes when I click on any image to open it. Thanks for the app. _Ù÷_"
0,0,0,1,0,0,0,0,0,0,0,0,0,7713,5789497a819cb706b00a7781,Wally,01.06.01,Ador Rahbar,17.06.16,3,Good but crashes a lot.... Always says stopped working
0,0,0,1,0,0,0,0,0,0,0,0,1,7714,57894977819cb706b00a777e,Wally,01.06.01,Sekhar Prudhivi,20.06.16,3,Crashing a lot The app keeps crashing when opening some wallpapers
0,0,0,0,0,0,0,0,0,0,0,0,0,7715,57894977819cb706b00a777d,Wally,01.06.01,_ø__ __µ„à_¡_µ__,21.06.16,5,"Like, repost"
0,0,0,1,0,0,0,0,0,0,0,0,0,7716,57894977819cb706b00a777c,Wally,01.06.01,Sankar Shaji,22.06.16,4,"Started getting buggy now Was best wallpaper app,now crashes a lot when opening wallpapers to download ."
0,0,0,1,0,0,0,0,0,0,0,0,1,7717,57894976819cb706b00a777a,Wally,01.06.01,misaal jayant,23.06.16,4,Force closing after starting app and loading screen of wallpaper.
0,0,0,1,0,0,0,0,0,0,0,0,0,7718,57894976819cb706b00a777b,Wally,01.06.01,Siddhant Chhabra,23.06.16,1,"Crashes App crashes a lot, can't use."
0,0,0,1,0,0,0,0,0,0,0,0,0,7719,57894976819cb706b00a7779,Wally,01.06.01,Nikeleswar Durai kannan,24.06.16,1,It is closing unexpectedly. What to do?
0,0,0,0,0,0,0,0,0,0,0,0,0,7720,57894976819cb706b00a7778,Wally,01.06.01,Juan JosÌ© Carpio,25.06.16,4,No updates Its a crear app but after about12 months of using it they never upload new wallpapers
0,0,0,1,0,0,0,0,0,0,0,0,1,7721,57894975819cb706b00a7777,Wally,01.06.01,Richard Forrest,26.06.16,2,"Crashes a lot, all of a sudden Clicking on images causes the app to crash. It's pretty much a broken app at this point."
0,0,0,0,0,0,0,0,0,0,0,0,0,7725,57894972819cb706b00a7774,Wally,01.06.01,Armando Lamas,30.06.16,5,Best wallpaper app I've used this app for over a year and still find ways yo personalize my phone with wallpapers
0,0,0,1,0,0,0,0,0,0,0,0,0,7726,57894972819cb706b00a7772,Wally,01.06.01,Rohan Jani,01.07.16,3,Would've given more but... It seems that the app is broken and some photos never load and ends up crashing the app altogether. Waiting on a fix for this
0,0,0,1,0,0,0,0,0,0,0,0,0,7728,5789496f819cb706b00a7770,Wally,01.06.01,Amrit Saini,02.07.16,3,Not stable
0,0,0,1,0,0,0,0,0,0,0,0,0,7730,5789496e819cb706b00a776c,Wally,01.06.01,sushant patil,03.07.16,4,Crash problems please fix it.
0,0,0,1,0,0,0,0,0,0,0,0,1,7732,5789496f819cb706b00a776e,Wally,01.06.01,Aditya Iyer,03.07.16,1,Does not work Just doesn't load anything.
0,0,0,1,0,0,0,0,0,0,0,0,0,7740,5789496b819cb706b00a7763,Wally,01.06.01,Judi ArÌ©valo,13.07.16,2,Still crashes :( After the update it's had more stability but after a few minutes it crashes again :( Please fix cuz before all this the app was great.
